{
  "$schema": "http://json-schema.org/draft-07/schema#",
  "type": "object",
  "required": ["curriculum_name", "project", "audience", "global_objectives", "phases", "metadata"],
  "properties": {
    "curriculum_name": {"type": "string"},
    "project": {
      "type": "object",
      "required": ["name", "description", "spec_file"],
      "properties": {
        "name": {"type": "string"},
        "description": {"type": "string"},
        "spec_file": {"type": "string"},
        "tech_stack": {
          "type": "object",
          "properties": {
            "frontend": {"type": "array", "items": {"type": "string"}},
            "backend": {"type": "array", "items": {"type": "string"}},
            "database": {"type": "array", "items": {"type": "string"}},
            "mobile": {"type": "array", "items": {"type": "string"}},
            "ai_ml": {"type": "array", "items": {"type": "string"}}
          }
        }
      }
    },
    "audience": {"type": "string"},
    "global_objectives": {
      "type": "array",
      "items": {"type": "string"}
    },
    "prerequisites": {
      "type": "array",
      "items": {"type": "string"}
    },
    "phases": {
      "type": "array",
      "items": {
        "type": "object",
        "required": ["phase_id", "phase_name", "estimated_hours"],
        "properties": {
          "phase_id": {"type": "string", "pattern": "^P[0-9]{2}$"},
          "phase_name": {"type": "string"},
          "estimated_hours": {"type": "integer", "minimum": 1},
          "module_count": {"type": "integer", "minimum": 1}
        }
      }
    },
    "total_estimated_hours": {"type": "integer", "minimum": 1},
    "total_modules": {"type": "integer", "minimum": 1},
    "pedagogy_principles": {
      "type": "array",
      "items": {"type": "string"}
    },
    "metadata": {
      "type": "object",
      "required": ["version", "created_at", "updated_at"],
      "properties": {
        "version": {"type": "string"},
        "created_at": {"type": "string", "format": "date"},
        "updated_at": {"type": "string", "format": "date"}
      }
    }
  }
}