{
  "curriculum_name": "Full-Stack Software Engineering – Jeff Hutting Edition",
  "project": {
    "name": "CatchBook",
    "description": "AI-powered fishing journal that auto-populates catch data using photo capture, EXIF metadata, and computer vision. Target: log catches in 10 seconds vs 3-5 minutes in competing apps.",
    "spec_file": "projects/catchbook-product-spec.md",
    "tech_stack": {
      "frontend": ["React", "TypeScript", "React Native"],
      "backend": ["Python", "FastAPI"],
      "database": ["PostgreSQL", "PostGIS"],
      "mobile": ["Progressive Web App", "React Native", "SwiftUI"],
      "ai_ml": ["Claude API", "TensorFlow", "MobileNetV2", "XGBoost"]
    }
  },
  "audience": "Self-directed adult learner transitioning toward professional software engineering",
  "global_objectives": [
    "Develop competency in modern full-stack web development",
    "Build and deploy real applications with increasing autonomy",
    "Gain confidence navigating real codebases and debugging problems",
    "Learn core computer science concepts relevant to practical engineering",
    "Create a professional portfolio demonstrating real technical capability",
    "Prepare effectively for technical interviews and professional collaboration"
  ],
  "prerequisites": [
    "Basic computer literacy",
    "Willingness to learn and persist through challenges",
    "Access to a computer with internet",
    "Time commitment of 10–15 hours per week",
    "Growth mindset and willingness to ask for help"
  ],
  "phases": [
    {
      "phase_id": "P01",
      "phase_name": "Foundations",
      "estimated_hours": 24,
      "module_count": 4
    },
    {
      "phase_id": "P02",
      "phase_name": "Professional Tooling",
      "estimated_hours": 24,
      "module_count": 4
    },
    {
      "phase_id": "P03",
      "phase_name": "Frontend Basics",
      "estimated_hours": 46,
      "module_count": 5
    },
    {
      "phase_id": "P04",
      "phase_name": "Python Fundamentals",
      "estimated_hours": 52,
      "module_count": 5
    },
    {
      "phase_id": "P05",
      "phase_name": "Data Structures & Algorithms",
      "estimated_hours": 58,
      "module_count": 5
    },
    {
      "phase_id": "P06",
      "phase_name": "Modern JavaScript",
      "estimated_hours": 40,
      "module_count": 3
    },
    {
      "phase_id": "P07",
      "phase_name": "TypeScript",
      "estimated_hours": 32,
      "module_count": 3
    },
    {
      "phase_id": "P08",
      "phase_name": "Backend API (FastAPI)",
      "estimated_hours": 52,
      "module_count": 5
    },
    {
      "phase_id": "P09",
      "phase_name": "Database Design",
      "estimated_hours": 50,
      "module_count": 5
    },
    {
      "phase_id": "P10",
      "phase_name": "Authentication & Security",
      "estimated_hours": 52,
      "module_count": 5
    },
    {
      "phase_id": "P11",
      "phase_name": "React Fundamentals",
      "estimated_hours": 58,
      "module_count": 5
    },
    {
      "phase_id": "P12",
      "phase_name": "React + TypeScript",
      "estimated_hours": 40,
      "module_count": 4
    },
    {
      "phase_id": "P13",
      "phase_name": "Node.js",
      "estimated_hours": 40,
      "module_count": 4
    },
    {
      "phase_id": "P14",
      "phase_name": "Advanced SQL & Analytics",
      "estimated_hours": 44,
      "module_count": 4
    },
    {
      "phase_id": "P15",
      "phase_name": "AI Integration (Claude API)",
      "estimated_hours": 44,
      "module_count": 4
    },
    {
      "phase_id": "P16",
      "phase_name": "Advanced AI Features",
      "estimated_hours": 52,
      "module_count": 4
    },
    {
      "phase_id": "P17",
      "phase_name": "External API Integration",
      "estimated_hours": 40,
      "module_count": 4
    },
    {
      "phase_id": "P18",
      "phase_name": "Equipment Tracking",
      "estimated_hours": 42,
      "module_count": 4
    },
    {
      "phase_id": "P19",
      "phase_name": "Testing",
      "estimated_hours": 50,
      "module_count": 5
    },
    {
      "phase_id": "P20",
      "phase_name": "Performance Optimization",
      "estimated_hours": 46,
      "module_count": 5
    },
    {
      "phase_id": "P21",
      "phase_name": "DevOps & Deployment",
      "estimated_hours": 48,
      "module_count": 5
    },
    {
      "phase_id": "P22",
      "phase_name": "Monitoring & Logging",
      "estimated_hours": 40,
      "module_count": 4
    },
    {
      "phase_id": "P23",
      "phase_name": "Progressive Web App",
      "estimated_hours": 38,
      "module_count": 4
    },
    {
      "phase_id": "P24",
      "phase_name": "Computer Science Fundamentals",
      "estimated_hours": 44,
      "module_count": 4
    },
    {
      "phase_id": "P25",
      "phase_name": "Software Architecture",
      "estimated_hours": 52,
      "module_count": 4
    },
    {
      "phase_id": "P26",
      "phase_name": "Accessibility & Internationalization",
      "estimated_hours": 36,
      "module_count": 4
    },
    {
      "phase_id": "P27",
      "phase_name": "Native Mobile",
      "estimated_hours": 58,
      "module_count": 4
    },
    {
      "phase_id": "P28",
      "phase_name": "Launch & Marketing",
      "estimated_hours": 50,
      "module_count": 5
    }
  ],
  "total_estimated_hours": 850,
  "total_modules": 139,
  "pedagogy_principles": [
    "Build real features for CatchBook, not throwaway exercises",
    "Small, shippable iterations that compound into complete product",
    "Just-in-time learning aligned with immediate project needs",
    "Production-quality code from day 1 (testing, docs, best practices)",
    "Architecture-first thinking: understand the 'why' before the 'how'"
  ],
  "metadata": {
    "version": "2.0",
    "created_at": "2025-12-03",
    "updated_at": "2025-12-03"
  }
}
